author_id,title,link
여행가쥬,발리 여행 꾸따 서핑 스쿨 한국어 강사 예약 비용 아이와 서핑 후기,https://blog.naver.com/shlej6/223844591178
릴 리,대만 타이베이 근교 여행지 이란 宜蘭 가볼만한곳 바다 서핑 등,https://blog.naver.com/l_b_v/223821968694
환진컬렉션,매니 피플 굿 웨이브 스랑안 서핑,https://blog.naver.com/h__h__n/223850110436
가영1기,"발리 서핑샵 추천 헬로서프 Hello surf / 서핑캠프 가격, 시설, 레슨 비기너패키지 미드랭스 도전 내돈내산 후기",https://blog.naver.com/hdbgy/223853518617
베를린+서울 사람,"발리여행 누사두아 그랜드 하얏트 근처 서핑 초보 레슨 추천, 장점 및 단점 Walkus surf school nusa dua",https://blog.naver.com/sweetkkubi/223843297087
Poursuis Tes Rêves,[독일 - 뮌헨] 혼여행 강추 / 여유로운 도시 / 소세지 핫도그 시나몬롤 프레첼 / 영국정원 / 서핑스팟 / 인형극 / 뮌헨에서 스트라스부르 플릭스버스,https://blog.naver.com/fafam101/223854434810
줌줌투어 공식 블로그 ⎮ ZoomZoomTour,호주 시드니 본다이비치 가는법 / 아이스버그 수영장 / 코스탈 워크 / 서핑 / 시드니 빅버스 블루라인 등,https://blog.naver.com/urimalo_/223836173481
oureve,발리 7박 9일 여행 ep.2 | 꾸따 서핑 포테이토헤드 짱구 누사페니다 스노쿨링 1일투어,https://blog.naver.com/oureve-/223852578948
"윤뜨의 잡담,","발리 서핑&물놀이여행4 : 아침서핑, 저녁힐링 (렘봉안 KAYU 카페, 맹그로브숲 투어, Kemilau Spa And Wellness)",https://blog.naver.com/cr326/223853588036
Olietti,"태국 푸켓여행 2일차 / Part1 - 카타비치 서핑, 파묵꼬리조트",https://blog.naver.com/jw443165/223850184633
드리프터,미우새가 찾은 양양 서핑강습샵은 어디일까?,https://ader.naver.com/v1/kz67sXAlJIqJBrbYwHlWSiKkJsZ0V0ZcsuMFpLI-vueHZfPT7Z84iWeh1i-NJzknu2r2b4JApLR7tviVlsOwmEOqz_9k0zAWukU0ZMHPDKOOfZgX7APTWuNmAqfO_zZUdC7l2oUJuImqeQpt_2eVzj4ECWpUgH2ICHzEI-K53wUHoGyvrpjl3J3XGI1p7-xsQDPG7IlwPkLqgjEeB2koyf6-A1nc0GB9us-9BczN6P5u9Bd1RbLWAtwreQaeTQrR?c=naver.search.pc.tab.blog.pwc&t=0
얼라이브스킴,파도가 없어도 서핑을 한다 #스킴보드,https://ader.naver.com/v1/kz67sXAlJIqJBrbYwHlWSiKkJsZ0V0ZcsuMFpLI-vueHZfPT7Z84iWeh1i-NJzknu2r2b4JApLR7tviVlsOwmCDiI-Rp8pNbvopDrWwAei8Pftboq3gBBo1bV1DFkk9MJNTpV-KlriRIU0cWnUct4ImWKfBZRM3lkvlvZGwi-5XzDsD9QnaYjuPqg6wiYEiKUZJrOwaQueNoKDA1jgOwpIXbUuLmNEit6aRU_T6Qsf__8SlL11Bu7NNFMa4Gg-Uo?c=naver.search.pc.tab.blog.pwc&t=0
"내맘대로 쓰는 블로그, 희맘대로","여자혼자 발리 한달살이 - 센소리움, 워케이션 카페 ZIN, 꾸따 서핑 766HI Surf",https://blog.naver.com/2daheeamond/223855311015
김덮밥,발리 2월 날씨 옷차림 3월 우기 건기 수영 우붓 기온 서핑 비행기값,https://blog.naver.com/dongi0508/223760879159
소내,유럽 자유 여행 / 독일 뮌헨 가볼만한곳 / 트램타고 영국 정원 산책 서핑 구경,https://blog.naver.com/sunae628/223835231043
"그래서, 오늘은 어디야?",2025 포르투갈 나자레 서핑 원 데이 클래스,https://blog.naver.com/juehye/223803961569
낭만이 우리의 주체사상,"발리 여행 - 꾸따 모닝서핑, 짱구 리볼버, 더 프랙티스 요가원, 꾸따 발리바나나",https://blog.naver.com/naburaengiii/223837972414
"EAT, TRAVEL, LOVE",[미국 뉴포트비치 서핑] - 미국 라구나비치에서 서핑배우기,https://blog.naver.com/seugg222/223855102429
블루앤의 블루스토리,발리 서핑 6세 10세 초등학생 완전 추천!!,https://blog.naver.com/bluestory8/223854978497
은하수여행가 초이,뉴질랜드 북섬 여행 서핑 후기 액티비티 주의사항,https://blog.naver.com/opeth_choi/223852415178
마녀씨,발리 가볼만한곳 꾸따 르기안비치 발리여행 서핑,https://blog.naver.com/queen77577/223729308133
Rasta’s SIMPLE LIFE,서핑 요가 스노클링까지 액티비티 천국 발리로 떠나는 취미여행,https://blog.naver.com/sugarbia/223841306922
조아서프,강원도 양양 서핑 수준 별 강습 배울수 있는곳,https://ader.naver.com/v1/kz67sXAlJIqJBrbYwHlWSiKkJsZ0V0ZcsuMFpLI-vudSWMWXNEx3E0nfmP2ceuIOHo1-Wh4u631AhtN4sVAdf4u3G5X3Ii56kYAjRGpLcQEQ3nZ0IB9JU320qFOQunDQzxswPv_i9XxmI-TYVUZbD2Zf3gMhhm8y7jsWjhz5E3lyG7ZUaR3rKiJWGI8dJN-GmONUJsu6BlHFRhMknmPgVpF7LlpCnvt5vD-qGe3tOPha7h_hZeh4RZwaxZuJQgSC?c=naver.search.pc.tab.blog.pwc&t=0
스토어허브,역시즌 스포츠 취미 용품 효율적인 짐보관 스토어허브,https://ader.naver.com/v1/kz67sXAlJIqJBrbYwHlWSiKkJsZ0V0ZcsuMFpLI-vuddmfdzuLzIYnIxI6I0GYX-z0iuVZElKtyOCT3O94-QiYGz1EbiZmIyZKn4TsouYWMSeQp4ylUWvOY2z9Ru7WM-gMiaUKSJNL7lOJUFGujMatOVzfQpK3oLWMa5HQAZwo6tJR4y43ypjixvvsBXJdGhtZeLD7hPSE8xv43go6cywFc61t26O910c4wsitZ-oIGiEvW3QfN5fubMeZEhE9cM_BLykbdO8oZ15_Ekq4K9-A==?c=naver.search.pc.tab.blog.pwc&t=0
구리오돈 블로그,[3things] 9. 첫 바다서핑.,https://blog.naver.com/msuho/223804183988
Good Day 여행하기,발리 항공권 최저가 직항 대한항공 남부지역 서핑 등 렌트카 자유여행,https://blog.naver.com/tjdrnr3oh/223778239873
테디공주,하와이 와이키키 여행 일정 추천 한국인 서핑 레슨 해변 로코서핑,https://blog.naver.com/teddyprincess/223836488617
여행하는 옞니의 한사하다,보라카이 여행 인생샷 남길수있는 불라복비치 카이트서핑과 야자수 포인트,https://blog.naver.com/yeahappy00/223728923771
Museum & Travel,"발리 - 서핑을 배우고 싶다면 발리로~, 다시 발리에 가고 싶은 이유가 된 서핑, 27 서프 스쿨",https://blog.naver.com/hitzza/223783760125
뮤린이의 일상(❁´◡`❁),멕시코 칸쿤 호텔존 알로프트 근처 현지인 맛집 서핑부리또 추천후기,https://blog.naver.com/yuhee1130/223834345927
페이지 너머로의 여행 일상 | 지구별시골쥐 김주영,발리 쿠타 스미냑 서핑 해변 수영장 추천 | 가격 준비물 맛집,https://blog.naver.com/jootime/223822335043
제네미아,[발리 스미냑] 27 surf 서핑 꾸따비치,https://blog.naver.com/jenemia/223830463815
와그 WAUG,다낭 미케 비치 : 한국어로 배우는 서핑 클래스 가격 코스 특징 총정리,https://blog.naver.com/waugmagazine/223800941671
여행하는 써니,하이난 한식 삼겹살맛집 한풍각 서핑명소 완닝 일월만,https://blog.naver.com/ainihs/223747810876
